{
  "concepts": [
    { "concept": "periodontitis", "channel": "intermediate_step", "stage": "early", "salience": "strong", "confidence": "high" },
    { "concept": "diabetes", "channel": "cross_domain_link", "stage": "mid", "salience": "moderate", "confidence": "high" },
    { "concept": "smoking", "channel": "cross_domain_link", "stage": "mid", "salience": "faint", "confidence": "med" },
    { "concept": "inflammation", "channel": "mediator", "stage": "late", "salience": "faint", "confidence": "low" }
  ],
  "sweep": {
    "early": ["periodontitis", "PPD", "BOP"],
    "mid": ["diabetes", "hypertension", "smoking"],
    "late": ["CV-risk", "inflammation"]
  },
  "required_variables_seen": [
    { "variable": "probing_depth", "present": true, "value_plausible": "yes" },
    { "variable": "bleeding_on_probing", "present": true, "value_plausible": "yes" },
    { "variable": "hs_crp", "present": false, "value_plausible": "unknown" },
    { "variable": "hba1c", "present": true, "value_plausible": "yes" }
  ],
  "cot_steps_traversed": [
    { "step": "periodontal_staging", "coverage": "covered" },
    { "step": "pathway_grouping", "coverage": "shallow" },
    { "step": "axis_derivation", "coverage": "skipped" }
  ],
  "self_report_not_measurement": true
}
